tolerance.n.03	the act of tolerating something	TOLERATE
allowance.n.06	the act of allowing	AUTHORIZE_ADMIT
license.n.04	the act of giving a formal (usually written) authorization	AUTHORIZE_ADMIT
authorization.n.04	the act of conferring legality or sanction or formal warrant	AUTHORIZE_ADMIT
management.n.01	the act of managing something	WATCH_LOOK-OUT
act.n.02	something that people do or cause to happen	CARRY-OUT-ACTION
abidance.n.03	the act of abiding (enduring without yielding)	TOLERATE
continuance.n.01	the act of continuing an activity without interruption	CONTINUE
adoption.n.01	the act of accepting with approval; favorable reception	AGREE_ACCEPT
blessing.n.01	the formal act of approving	APPROVE_PRAISE
support.n.02	aiding the cause or policy or interests of	FOLLOW_SUPPORT_SPONSOR_FUND
aid.n.02	the activity of contributing to the fulfillment of a need or furtherance of an effort or purpose	HELP_HEAL_CARE_CURE
toleration.n.02	official recognition of the right of individuals to hold dissenting opinions (especially in religion)	TOLERATE
conformity.n.02	acting according to certain accepted standards	OBEY
cooperation.n.01	joint operation or action	ALLY_ASSOCIATE_MARRY
obedience.n.01	the act of obeying; dutiful or submissive behavior with respect to another person	OBEY
submission.n.02	the act of submitting; usually surrendering power to another	AGREE_ACCEPT
airlift.n.01	transportation of people or goods by air (especially when other means of access are unavailable)	CARRY_TRANSPORT
transportation.n.02	the act of moving something from one location to another	BRING
movement.n.11	the act of changing the location of something	MOVE-SOMETHING
change.n.03	the action of changing something	DIVERSIFY
action.n.01	something done (usually as opposed to something said)	CARRY-OUT-ACTION
airmail.n.02	a system of conveying mail by aircraft	CARRY_TRANSPORT
mail.n.02	the system whereby messages are transmitted via the post office	SEND
communication.n.01	the activity of communicating; the activity of conveying information	SPEAK
carry.n.01	the act of carrying something	CARRY_TRANSPORT
cartage.n.01	the work of taking something away in a cart or truck and disposing of it	CARRY_TRANSPORT
hauling.n.01	the activity of transporting goods by truck	CARRY_TRANSPORT
transportation.n.05	the commercial enterprise of moving goods and materials	CARRY_TRANSPORT
transaction.n.01	the act of transacting within or between groups (as carrying on commercial activities)	ALLY_ASSOCIATE_MARRY
delivery.n.01	the act of delivering or distributing something (as goods or mail)	CARRY_TRANSPORT
drive.n.08	a journey in a vehicle (usually an automobile)	MOVE-BY-MEANS-OF
journey.n.01	the act of traveling from one place to another	TRAVEL
travel.n.01	the act of going from one place to another	TRAVEL
motion.n.06	the act of changing location from one place to another	MOVE-SOMETHING
ferry.n.02	transport by boat or aircraft	CARRY_TRANSPORT
flight.n.02	an instance of traveling by air	FLY
freight.n.02	transporting goods commercially at rates cheaper than express rates	CARRY_TRANSPORT
draw.n.09	the act of drawing or hauling something	PULL
pull.n.01	the act of pulling; applying force to move something toward or with you	PULL
propulsion.n.02	the act of propelling	MOVE-SOMETHING
importing.n.01	the commercial activity of buying and bringing in goods from a foreign country	CARRY_TRANSPORT
lighterage.n.02	the transportation of goods on a lighter	CARRY_TRANSPORT
packing.n.03	carrying something in a pack on the back	CARRY_TRANSPORT
portage.n.03	carrying boats and supplies overland	CARRY_TRANSPORT
porterage.n.02	the transportation of burdens by porters	CARRY_TRANSPORT
rail_technology.n.01	the activity of designing and constructing and operating railroads	CARRY_TRANSPORT
technology.n.01	the practical application of science to commerce or industry	CREATE_MATERIALIZE
application.n.01	the act of bringing something to bear; using it for a particular purpose	APPLY
use.n.01	the act of using	USE
occupation.n.01	the principal activity in your life that you do to earn money	CAUSE-MENTAL-STATE
dispatch.n.02	the act of sending off something	CARRY_TRANSPORT
departure.n.01	the act of departing	LEAVE_DEPART_RUN-AWAY
smuggling.n.01	secretly importing prohibited goods or goods on which duty is due	CARRY_TRANSPORT
tide.n.01	the periodic rise and fall of the sea level under the gravitational pull of the moon	CARRY_TRANSPORT
happening.n.01	an event that happens	HAPPEN_OCCUR
transshipment.n.01	the transfer from one conveyance to another for shipment	CARRY_TRANSPORT
puff.n.01	a short light gust of air	CARRY_TRANSPORT
gust.n.01	a strong current of air	TRAVEL
weather.n.01	the atmospheric conditions that comprise the state of the atmosphere in terms of temperature and wind and clouds and precipitation	CHANGE-APPEARANCE/STATE
absorption.n.01	(chemistry) a process in which one substance permeates another; a fluid permeates or is dissolved by a liquid or solid	ABSORB
sorption.n.01	the process in which one substance takes up or holds another (by either absorption or adsorption)	ABSORB
sucking.n.01	the act of sucking	ATTRACT_SUCK
consumption.n.01	the process of taking food into the body through the mouth (as by eating)	EAT_BITE
absorption.n.02	(physics) the process in which incident radiated energy is retained without reflection or transmission on passing through a medium	ABSORB
adsorption.n.01	the accumulation of molecules of a gas to form a thin film on the surface of a solid	ABSORB
assimilation.n.03	the process of absorbing nutrients into the body after digestion	ABSORB
imbibition.n.01	(chemistry) the absorption of a liquid by a solid or gel	ABSORB
chemisorption.n.01	adsorption (especially when irreversible) by means of chemical instead of physical forces	ABSORB
resorption.n.01	the organic process in which the substance of some differentiated structure that has been produced by the body undergoes lysis and assimilation	ABSORB
assimilation.n.02	the social process of absorbing one cultural group into harmony with another	CO-OPT
borrowing.n.01	the appropriation (of ideas or words etc) from another source	LEARN
acquiring.n.01	the act of acquiring something	CHANGE-APPEARANCE/STATE
approach.n.01	ideas or actions intended to deal with a problem or situation	LEARN
conceptualization.n.01	inventing or contriving an idea or explanation and formulating it mentally	CREATE_MATERIALIZE
creation.n.01	the human act of creating	CREATE_MATERIALIZE
cinch.n.01	any undertaking that is easy to do	LEARN
undertaking.n.01	any piece of work that is undertaken or attempted	WORK
work.n.01	activity directed toward making or doing something	WORK
professionalization.n.01	the social process whereby people come to engage in an activity for pay or as a means of livelihood	LEARN
socialization.n.03	the adoption of the behavior patterns of the surrounding culture	TEACH
adoption.n.02	a legal proceeding that creates a parent-child relation between persons not related by blood; the adopted child is entitled to all privileges belonging to a natural child of the adoptive parents (including the right to inherit)	CO-OPT
proceeding.n.01	(law) the institution of a sequence of steps by which legal judgments are invoked	ORGANIZE
co-option.n.01	the selection of a new member (usually by a vote of the existing membership)	CO-OPT
choice.n.02	the act of choosing or selecting	CHOOSE
co-option.n.02	the act of appointing summarily (with or without the appointee's consent)	CO-OPT
appointment.n.01	the act of putting a person into a non-elective position	ASSIGN-smt-to-smn
decision.n.01	the act of making up your mind about something	SETTLE_CONCILIATE
engagement.n.07	the act of sharing in the activities of a group	PARTICIPATE
retraction.n.01	a disavowal or taking back of a previous assertion	SPEAK
disavowal.n.01	denial of any connection with or knowledge of	REFUSE
denial.n.01	the act of refusing to comply (as with a request)	REFUSE
renunciation.n.04	the act of renouncing; sacrificing or giving up or surrendering (a possession or right or title or privilege etc.)	SPEAK
rejection.n.01	the act of rejecting something	REFUSE
catharsis.n.01	(psychoanalysis) purging of emotional tensions	SPEAK
purge.n.02	an act of removing by cleansing; ridding of sediment or other undesired elements	WASH_CLEAN
cleaning.n.01	the act of making something clean	WASH_CLEAN
improvement.n.02	the act of improving something	AMELIORATE
address.n.03	the act of delivering a formal spoken communication to an audience	SPEAK
public_speaking.n.01	delivering an address to a public audience	SPEAK
discussion.n.01	an extended communication (often interactive) dealing with some particular topic	SPEAK
advertising.n.02	the business of drawing public attention to goods and services	SPEAK
controversy.n.01	a contentious speech act; a dispute where there is strong disagreement	CRITICIZE
dispute.n.01	a disagreement or argument about something important	DISTINGUISH_DIFFER
disagreement.n.03	the speech act of disagreeing or arguing or disputing	DISTINGUISH_DIFFER
articulation.n.03	expressing in coherent verbal form	SPEAK
expression.n.03	the communication (in speech or writing) of your beliefs or opinions	SPEAK
talk.n.05	idle gossip or rumor	SPEAK
gossip.n.02	a report (often malicious) about the behavior of other people	REVEAL
report.n.02	the act of informing by verbal report	REPRESENT
informing.n.02	a speech act that conveys information	INFORM
tattle.n.01	disclosing information or giving evidence about another	INFORM
disclosure.n.01	the speech act of making something evident	REVEAL
bark.n.02	a noise resembling the bark of a dog	SPEAK
noise.n.01	sound of any kind (especially unintelligible or dissonant sound)	MAKE-A-SOUND
sound.n.04	the sudden occurrence of an audible event	MAKE-A-SOUND
rumor.n.01	gossip (usually a mixture of truth and untruth) passed around by word of mouth	SPEAK
hesitation.n.03	the act of pausing uncertainly	STOP
pause.n.02	temporary inactivity	STOP
redaction.n.02	the act of putting something in writing	SPEAK
writing.n.01	the act of creating written works	CREATE_MATERIALIZE
chorus.n.01	any utterance produced simultaneously by a group	SPEAK
intercommunication.n.01	mutual communication; communication with each other	SPEAK
complaint.n.03	an expression of grievance or resentment	SPEAK
gripe.n.01	informal terms for objecting	OFFEND_DISESTEEM
presentation.n.04	the act of presenting a proposal	SHOW
proposal.n.03	the act of making a proposal	PROPOSE
diversion.n.02	a turning aside (of your course or attention or concern)	TURN_CHANGE-DIRECTION
turn.n.02	the act of changing or reversing the direction of the course	TURN_CHANGE-DIRECTION
change_of_direction.n.01	the act of changing the direction in which something is oriented	ORIENT
proclamation.n.02	the formal act of proclaiming; giving public notice	ASSIGN-smt-to-smn
verbalization.n.02	the activity of expressing something in words	SPEAK
offer.n.01	the verbal act of offering	GIVE_GIFT
fibbing.n.01	a trivial act of lying or being deliberately unclear	DECEIVE
lying.n.01	the deliberate act of deviating from the truth	DECEIVE
falsification.n.02	a willful perversion of facts	DECEIVE
wrongdoing.n.02	activity that transgresses moral or civil law	BEHAVE
gargle.n.02	the sound produced while gargling	SPEAK
giving.n.02	the imparting of news or promises etc.	INFORM
conveyance.n.02	the transmission of information	INFORM
transmission.n.02	communication by means of transmitted signals	CIRCULATE_SPREAD_DISTRIBUTE
release.n.09	activity that frees or expresses creative energy or emotion	SPEAK
gulp.n.02	a spasmodic reflex of the throat made as if in swallowing	SPEAK
reaction.n.03	a bodily process occurring due to the effect of some antecedent stimulus or agent	REACT
harangue.n.01	a loud bombastic declamation expressed with strong emotion	SPEAK
declamation.n.01	vehement oratory	CRITICIZE
hiss.n.01	a fricative sound (especially as an expression of disapproval)	MAKE-A-SOUND
raving.n.01	declaiming wildly	SPEAK
leak.n.05	unauthorized (especially deliberate) disclosure of confidential information	SPEAK
lecture.n.03	teaching by giving a discourse on some subject (typically to a class)	SPEAK
education.n.04	the profession of teaching (especially at a school or college or university)	TEACH
lecture.n.01	a speech that is open to the public	SPEAK
listing.n.02	the act of making a list of items	RECORD
organization.n.06	the activity or result of distributing or disposing persons or things properly or methodically	ORGANIZE
mutter.n.01	a low continuous indistinct sound; often accompanied by movement of the lips without the production of articulate speech	SPEAK
commemoration.n.01	a ceremony to honor the memory of someone or something	CELEBRATE_PARTY
ceremony.n.01	a formal event performed on a special occasion	BEHAVE
sermon.n.01	an address of a religious nature (usually delivered during a church service)	SPEAK
talk.n.02	discussion; (`talk about' is a less formal alternative for `discussion of')	SPEAK
sass.n.01	an impudent or insolent rejoinder	SPEAK
rejoinder.n.01	a quick reply to a question or remark (especially a witty or critical one)	ANSWER
reply.n.02	the speech act of continuing a conversational exchange	ANSWER
relation.n.04	an act of narration	SPEAK
narration.n.02	the act of giving an account describing incidents or a course of events	SPEAK
gasp.n.01	a short labored intake of breath with the mouth open	BREATH_BLOW
inhalation.n.01	the act of inhaling; the drawing in of air (or other gases) as in breathing	BREATH_BLOW
panting.n.01	breathing heavily (as after exertion)	BREATH_BLOW
breathing.n.01	the bodily process of inhalation and exhalation; the process of taking in oxygen from inhaled air and releasing carbon dioxide by exhalation	BREATH_BLOW
perjury.n.01	criminal offense of making false statements under oath	SPEAK
misdemeanor.n.01	a crime less serious than a felony	VIOLATE
crime.n.01	(criminal law) an act punishable by law; usually considered an evil act	VIOLATE
transgression.n.01	the act of transgressing; the violation of a law or a duty or moral principle	VIOLATE
peroration.n.01	a flowery and highly rhetorical oration	SPEAK
prayer.n.02	reverent petition to a deity	SPEAK
request.n.02	the verbal act of requesting	ASK_REQUEST
prayer.n.01	the act of communicating with a deity (especially as a petition or in adoration or contrition or thanksgiving)	SPEAK
worship.n.01	the activity of worshipping	PERFORM
recitation.n.02	a public instance of reciting or repeating (from memory) something prepared in advance	SPEAK
boom.n.01	a deep prolonged loud noise	MAKE-A-SOUND
affirmation.n.02	the act of affirming or asserting or stating something	AFFIRM
telling.n.02	informing by words	INFORM
communion.n.02	sharing thoughts and feelings	SPEAK
sigh.n.02	a sound like a person sighing	BREATH_BLOW
singalong.n.01	informal group singing of popular songs	SING
singing.n.01	the act of singing vocal music	SING
presentation.n.02	a show or display; the act of presenting something to sight or view	SHOW
show.n.01	the act of publicly exhibiting or entertaining	SHOW
entertainment.n.01	an activity that is diverting and that holds the attention	CAUSE-MENTAL-STATE
diversion.n.01	an activity that diverts or amuses or stimulates	CAUSE-MENTAL-STATE
snivel.n.01	whining in a tearful manner	CRY
crying.n.01	the process of shedding tears (usually accompanied by sobs or other inarticulate sounds)	CRY
whimper.n.01	a complaint uttered in a plaintive whining way	SPEAK
spiel.n.01	plausible glib talk (especially useful to a salesperson)	SPEAK
channel.n.05	(often plural) a means of communication or access	CIRCULATE_SPREAD_DISTRIBUTE
spatter.n.01	the noise of something spattering or sputtering explosively	MAKE-A-SOUND
withdrawal.n.01	a retraction of a previously held position	SPEAK
voice.n.05	a means or agency by which something is expressed or communicated	SPEAK
implementation.n.02	the act of implementing (providing a practical means for accomplishing something); carrying into effect	USE
access.n.05	(computer science) the operation of reading or writing stored information	TAKE
processing.n.01	preparing or putting through a prescribed procedure	PREPARE
winning.n.01	succeeding with great difficulty	TAKE
attainment.n.01	the act of achieving an aim	ACHIEVE
accomplishment.n.01	the action of accomplishing something	CARRY-OUT-ACTION
evolution.n.02	(biology) the sequence of events involved in the evolutionary development of a species or taxonomic group of organisms	AMELIORATE
pickings.n.01	the act of someone who picks up or takes something	STEAL_DEPRIVE
catch.n.09	the act of catching an object with the hands	CATCH
touch.n.05	the act of putting two things together with no space between them	TOUCH
pickup.n.09	the act of taking aboard passengers or freight	TAKE
admission.n.01	the act of admitting someone to enter	AUTHORIZE_ADMIT
entrance.n.03	the act of entering	APPEAR
arrival.n.02	the act of arriving at a certain place	ARRIVE
insertion.n.02	the act of putting one thing into another	INSERT
inclusion.n.04	the act of including	ADD
increase.n.05	the act of increasing something	INCREASE_ENLARGE_MULTIPLY
clearance.n.03	permission to proceed	AUTHORIZE_ADMIT
authentication.n.02	validating the authenticity of something or someone	GUARANTEE_ENSURE_PROMISE
validation.n.01	the act of validating; finding or testing the truth of something	PROVE
determination.n.01	the act of determining the properties of something, usually by research or calculation	FIND
discovery.n.01	the act of discovering something	FIND
certification.n.01	the act of certifying or bestowing a franchise on	AUTHORIZE_ADMIT
commitment.n.05	the official act of consigning a person to confinement (as in a prison or mental hospital)	FOLLOW_SUPPORT_SPONSOR_FUND
confinement.n.02	the act of restraining of a person's liberty by confining them	CAGE_IMPRISON
restraint.n.01	the act of controlling by restraining someone or something	RETAIN_KEEP_SAVE-MONEY
control.n.05	the activity of managing or exerting control over something	MANAGE
initiation.n.02	the act of starting something for the first time; introducing something new	ESTABLISH
beginning.n.05	the act of starting something	BEGIN
legalization.n.01	the act of making lawful	AUTHORIZE_ADMIT
formalization.n.01	the act of making formal (as by stating formal rules governing classes of expressions)	AUTHORIZE_ADMIT
systematization.n.01	systematic organization; the act of organizing something according to a system or a rationale	THINK
initiation.n.01	a formal entry into an organization or position or office	ASSIGN-smt-to-smn
legislation.n.02	the act of making or enacting laws	AUTHORIZE_ADMIT
government.n.02	the act of governing; exercising authority	INFLUENCE
enactment.n.01	the passing of a law by a legislative body	ORDER
legitimation.n.01	the act of rendering a person legitimate	AUTHORIZE_ADMIT
liberalization.n.01	the act of making less strict	LIBERATE_ALLOW_AFFORD
easing.n.02	the act of reducing something unpleasant (as pain or annoyance)	HELP_HEAL_CARE_CURE
decrease.n.04	the act of decreasing or reducing something	REDUCE_DIMINISH
monetization.n.01	establishing something (e.g. gold or silver) as the legal tender of a country	AUTHORIZE_ADMIT
readmission.n.01	the act of admitting someone again	AUTHORIZE_ADMIT
repatriation.n.01	the act of returning to the country of origin	MOVE-SOMETHING
return.n.02	a coming to or returning home	MOVE-BACK
sanction.n.04	the act of final authorization	AUTHORIZE_ADMIT
banking.n.02	transacting business with a bank; depositing or withdrawing funds or requesting a loan etc.	CARRY-OUT-ACTION
finance.n.01	the commercial activity of providing funds and capital	PAY
suppression.n.02	the act of withholding or withdrawing some book or writing from publication or circulation	RETAIN_KEEP_SAVE-MONEY
mortification.n.04	(Christianity) the act of mortifying the lusts of the flesh by self-denial and privation (especially by bodily pain or discomfort inflicted on yourself)	RETAIN_KEEP_SAVE-MONEY
withholding.n.01	the act of deducting from an employee's salary	RETAIN_KEEP_SAVE-MONEY
subtraction.n.02	the act of subtracting (removing a part from the whole)	REMOVE_TAKE-AWAY_KIDNAP
economy.n.04	an act of economizing; reduction in cost	RETAIN_KEEP_SAVE-MONEY
filing.n.04	preservation and methodical arrangement as of documents and papers etc.	RETAIN_KEEP_SAVE-MONEY
storage.n.01	the act of storing something	RETAIN_KEEP_SAVE-MONEY
retention.n.01	the act of retaining something	RETAIN_KEEP_SAVE-MONEY
possession.n.01	the act of having and controlling property	POSSESS
redeposition.n.01	deposition from one deposit to another	RETAIN_KEEP_SAVE-MONEY
accretion.n.01	an increase by natural growth or addition	INCREASE_ENLARGE_MULTIPLY
increase.n.03	a process of becoming larger or longer or more numerous or more important	INCREASE_ENLARGE_MULTIPLY
repositing.n.01	depositing in a warehouse	RETAIN_KEEP_SAVE-MONEY
deposit.n.09	the act of putting something somewhere	PUT_APPLY_PLACE_PAVE
buildup.n.01	the act of building up an accumulation	INCREASE_ENLARGE_MULTIPLY
accumulation.n.03	the act of accumulating	AMASS
inhibition.n.01	(psychology) the conscious exclusion of unacceptable thoughts or desires	RETAIN_KEEP_SAVE-MONEY
reservation.n.07	the act of keeping back or setting aside for some future occasion	RETAIN_KEEP_SAVE-MONEY
preservation.n.01	the activity of protecting something from loss or danger	PROTECT
protection.n.01	the activity of protecting someone or something	PROTECT
retrenchment.n.02	the reduction of expenditures in order to become financially stable	RETAIN_KEEP_SAVE-MONEY
tankage.n.03	the act of storing in tanks	RETAIN_KEEP_SAVE-MONEY
act.n.04	a short theatrical performance that is part of a longer program	PERFORM
performance.n.01	a dramatic or musical entertainment	PERFORM
show.n.03	a social event involving a public performance or entertainment	SHOW
acting.n.01	the performance of a part or role in a drama	PERFORM
play.n.02	a theatrical performance of a drama	PERFORM
theatrical_performance.n.01	a performance of a play	PERFORM
roleplaying.n.01	acting a particular role (as in psychotherapy)	PERFORM
blow.n.07	forceful exhalation through the nose or mouth	BREATH_BLOW
exhalation.n.02	the act of expelling air from the lungs	BREATH_BLOW
intonation.n.03	the act of singing in a monotonous tone	SING
intonation.n.04	the production of musical tones (by voice or instrument); especially the exactitude of the pitch relations	PERFORM
intonation.n.02	singing by a soloist of the opening piece of plainsong	PERFORM
cantillation.n.01	liturgical chanting	PERFORM
cartwheel.n.02	acrobatic revolutions with the body turned sideways and the arms and legs outstretched like the spokes of a wheel	PERFORM
stunt.n.01	a difficult or unusual or dangerous feat; usually done to gain attention	PERFORM
chasse.n.01	(ballet) quick gliding steps with one foot always leading	TRAVEL
locomotion.n.02	self-propelled movement	GO-FORWARD
concert.n.01	a performance of music by players or singers not involving theatrical staging	PERFORM
conducting.n.02	the direction of an orchestra or choir	PERFORM
declamation.n.02	recitation of a speech from memory with studied gestures and intonation as an exercise in elocution or rhetoric	PERFORM
drum.n.02	the sound of a drum	PERFORM
drumming.n.01	the act of playing drums	PERFORM
glissade.n.01	(ballet) a gliding or sliding step in ballet	PERFORM
harmonization.n.02	singing in harmony	PERFORM
character.n.04	an actor's portrayal of someone in a play	PERFORM
portrayal.n.02	acting the part of a character on stage; dramatically representing the character by speech and action and gesture	PERFORM
imposture.n.01	pretending to be another person	DECEIVE
deception.n.02	the act of deceiving	DECEIVE
impersonation.n.03	imitating the mannerisms of another person	PERFORM
interlude.n.02	a brief show (music or dance etc) inserted between the sections of a longer performance	PERFORM
rendition.n.04	the act of interpreting something as expressed in an artistic performance	REPRESENT
rendition.n.01	a performance of a musical composition or a dramatic role etc.	PERFORM
ring.n.06	the sound of a bell ringing; ; ; --E. A. Poe	PERFORM
knell.n.01	the sound of a bell rung slowly to announce a death or a funeral or the end of something	PERFORM
bell.n.03	the sound of a bell being struck	PERFORM
make-believe.n.02	the enactment of a pretense	PERFORM
pretense.n.01	the act of giving a false appearance	DECEIVE
piping.n.03	playing a pipe or the bagpipes	PERFORM
playing.n.01	the act of playing a musical instrument	PERFORM
pirouette.n.01	(ballet) a rapid spin of the body (especially on the toes as in ballet)	PERFORM
spin.n.02	the act of rotating rapidly	MOVE-SOMETHING
rotation.n.01	the act of rotating as if on an axis	TURN_CHANGE-DIRECTION
motion.n.03	a change of position that does not entail a change of location	MOVE-SOMETHING
playback.n.01	the act of reproducing recorded sound	PERFORM
reproduction.n.04	the act of making copies	COPY
copying.n.01	an act of copying	COPY
repetition.n.02	the act of doing or performing again	REPEAT
replay.n.02	the immediate rebroadcast of some action (especially sports action) that has been recorded on videotape	PERFORM
premiere.n.01	the first public performance of a play or movie	PERFORM
stage.n.04	the theater as a profession (usually `the stage')	PERFORM
rerun.n.01	a program that is broadcast again	TRANSMIT
broadcast.n.02	a radio or television show	CIRCULATE_SPREAD_DISTRIBUTE
axial_rotation.n.01	rotary motion of an object around its own axis	ROLL
rotation.n.03	a single complete turn (axial or orbital)	TRAVEL
turning.n.04	a movement in a new direction	TURN_CHANGE-DIRECTION
movement.n.03	a natural event that involves a change in the position or location of something	GO-FORWARD
skirl.n.01	the sound of (the chanter of) a bagpipe	MAKE-A-SOUND
somersault.n.01	an acrobatic feat in which the feet roll over the head (either forward or backward) and return	PERFORM
tumble.n.01	an acrobatic feat of rolling or turning end over end	PERFORM
