mineral_extraction.n.01	crushing and separating ore into valuable substances or waste by any of a variety of techniques	PREPARE
face-off.n.02	(ice hockey) the method of starting play; a referee drops the puck between two opposing players	PREPARE
elaboration.n.05	developing in intricate and painstaking detail	EMBELLISH
warm-up.n.01	exercising in preparation for strenuous activity	PREPARE
precondition.n.03	a condition that is a prerequisite	PREPARE
intervention.n.01	the act of intervening (as to mediate a dispute, etc.)	PARTICIPATE
mediation.n.02	the act of intervening for the purpose of bringing about a settlement	NEGOTIATE
arbitration.n.02	the act of deciding as an arbiter; giving authoritative judgment	NEGOTIATE
convulsion.n.02	violent uncontrollable contractions of muscles	PRESS_PUSH_FOLD
squawk.n.01	the noise of squawking	SHOUT
dramatization.n.01	conversion into dramatic form	REPRESENT
dramatization.n.02	a dramatic representation	REPRESENT
embodiment.n.03	giving concrete form to an abstract concept	REPRESENT
characterization.n.02	the act of describing distinctive characteristics or essential features	REPRESENT
stylization.n.01	the act of stylizing; causing to conform to a particular style	REPRESENT
conventionalization.n.01	the act of conventionalizing; conforming to a conventional style	WELCOME
distortion.n.04	a change (usually undesired) in the waveform of an acoustic or analog electrical signal; the difference between two measurements of a signal (as between the input and output signal)	REPRESENT
distortion.n.06	the mistake of misrepresenting the facts	REPRESENT
distortion.n.05	the act of distorting something so it seems to mean something it was not intended to mean	DECEIVE
warp.n.03	a moral or mental distortion	REPRESENT
distortion.n.01	a change for the worse	SHAPE
drama.n.02	an episode that is turbulent or highly emotional	EMBELLISH
personification.n.03	the act of attributing human characteristics to abstract ideas etc.	REPRESENT
portraiture.n.02	the activity of making portraits	PAINT
typification.n.02	the act of representing by a type or symbol; the action of typifying	REPRESENT
symbolizing.n.01	the act of representing something with a symbol	REPRESENT
application.n.06	a diligent effort	FOCUS
commitment.n.02	the act of binding yourself (intellectually or emotionally) to a course of action	FOCUS
consecration.n.01	a solemn commitment of your life or your time to some cherished purpose (to a service or a goal)	FOCUS
idolatry.n.01	religious zeal; the willingness to serve God	FOCUS
devotion.n.02	commitment to some purpose	FOCUS
rededication.n.01	a new dedication	FOCUS
specialization.n.01	the act of specializing; making something suitable for a special purpose	FOCUS
deference.n.01	a courteous expression (by word or deed) of esteem or regard	LIKE
fetish.n.03	excessive or irrational devotion to some activity	LIKE
idolization.n.02	the act of worshiping blindly and to excess	LIKE
briefing.n.01	detailed instructions, as for a military operation	TEACH
coaching.n.01	the job of a professional coach	TEACH
employment.n.02	the occupation for which you are paid	WORK
debriefing.n.01	report of a mission or task	TEACH
drill.n.04	(military) the training of soldiers to march (as in ceremonial parades) or to perform the manual of arms	TEACH
evangelism.n.01	zealous preaching and advocacy of the gospel	TEACH
inculcation.n.01	teaching or impressing upon the mind by frequent instruction or repetition	TEACH
indoctrination.n.01	teaching someone to accept doctrines uncritically	TEACH
homily.n.01	a sermon on a moral or religious topic	TEACH
retraining.n.01	training for a new occupation	TEACH
schooling.n.01	the act of teaching at school	TEACH
sensitization.n.02	(psychology) the process of becoming highly sensitive to specific events or situations (especially emotional events or situations)	TEACH
spoonfeeding.n.02	teaching in an overly simplified way that discourages independent thought	TEACH
toilet_training.n.01	training a young child to use the toilet	TEACH
tutelage.n.01	teaching pupils individually (usually by a tutor hired privately)	TEACH
indication.n.02	the act of indicating or pointing out by name	SIGNAL_INDICATE
fingering.n.01	the placement of the fingers for playing different notes (or sequences of notes) on a musical instrument	SIGNAL_INDICATE
lineation.n.02	the act of marking or outlining with lines	SIGNAL_INDICATE
marking.n.04	the act of making a visible mark on a surface	SIGNAL_INDICATE
decoration.n.03	the act of decorating something (in the hope of making it more attractive)	EMBELLISH
carol.n.02	a joyful song (usually celebrating the birth of Christ)	SING
song.n.03	the act of singing	SING
crooning.n.01	singing in a soft low tone	SING
crooning.n.02	the act of singing popular songs in a sentimental manner	SING
yodeling.n.01	singing by changing back and forth between the chest voice and a falsetto	SING
humming.n.02	the act of singing with closed lips	SING
solmization.n.02	singing using solfa syllables to denote the notes of the scale of C major	SING
divulgence.n.01	the act of disclosing something that was secret or private	REVEAL
giveaway.n.02	an unintentional disclosure	REVEAL
revelation.n.03	communication of knowledge to man by a divine or supernatural agency	REVEAL
double_cross.n.01	an act of betrayal	BETRAY
cartoon.n.02	a film made by photographing a series of cartoon drawings to give the illusion of movement when projected in rapid sequence	PAINT
construction.n.05	drawing a figure satisfying certain conditions as part of solving a problem or proving a theorem	PAINT
tracing.n.01	the act of drawing a plan or diagram or outline	PAINT
drawing.n.03	the creation of artistic pictures or diagrams	PAINT
schematization.n.01	providing a chart or outline of a system	PAINT
distemper.n.05	a method of painting in which the pigments are mixed with water and a binder; used for painting posters or murals or stage scenery	PAINT
painting.n.02	creating a picture with paints	PAINT
finger-painting.n.02	painting by using the fingers to spread the paint	PAINT
fresco.n.02	a durable method of painting on a wall by using watercolors on wet plaster	PAINT
miniaturization.n.01	act of making on a greatly reduced scale	PAINT
painting.n.04	the occupation of a house painter	PAINT
striping.n.01	the act of marking with stripes	PAINT
view.n.03	the act of looking or seeing or observing	SEE
tattoo.n.03	the practice of making a design on the skin by pricking and staining	PAINT
crouch.n.01	the act of bending low with the limbs close to the body	LOWER
bow.n.06	bending the head or body or knee as a sign of reverence or submission or shame or greeting	LOWER
curtsy.n.01	bending the knees; a gesture of respect made by women	LOWER
bob.n.07	a short abrupt inclination (as of the head)	LOWER
prostration.n.02	abject submission; the emotional equivalent of prostrating your body	LOWER
prostration.n.03	the act of assuming a prostrate position	LOWER
lowering.n.02	the act of causing something to move to a lower level	LOWER
fall.n.07	a movement downward	LOWER
conge.n.03	an abrupt and unceremonious dismissal	LOWER
genuflection.n.01	the act of bending the knees in worship or reverence	LOWER
scrape.n.03	a deep bow with the foot drawn backwards (indicating excessive humility)	LOWER
kowtow.n.01	a former Chinese custom of touching the ground with the forehead as a sign of respect or submission	LOWER
kneel.n.01	supporting yourself on your knees	LOWER
settling.n.01	a gradual sinking to a lower level	LOWER
sinking.n.01	a descent as through liquid (especially through water)	DIP_DIVE
perversion.n.03	the action of perverting something (turning it to a wrong use)	VIOLATE
misuse.n.01	improper or excessive use	APPLY
breach.n.01	a failure to perform some promised act or obligation	VIOLATE
housebreaking.n.01	trespassing for an unlawful purpose; illegal entrance into premises with criminal intent	VIOLATE
perpetration.n.01	the act of committing a crime	VIOLATE
pull.n.07	a sustained effort	VIOLATE
profanation.n.01	blasphemous behavior; the act of depriving something of its sacred character	VIOLATE
irreverence.n.02	a disrespectful act	VIOLATE
trespass.n.02	entry to another's property without right or permission	VIOLATE
foul.n.01	an act that violates the rules of a sport	VIOLATE
infiltration.n.01	a process in which individuals (or small groups) penetrate an area (especially the military penetration of enemy positions without detection)	VIOLATE
irruption.n.01	a sudden violent entrance; a bursting in	VIOLATE
meddling.n.01	the act of altering something secretly or improperly	VIOLATE
trespass.n.01	a wrongful interference with the possession of property (personal property as well as realty), or the action instituted to recover damages	VIOLATE
issue.n.11	the act of issuing printed materials	PUBLISH
publication.n.04	the business of issuing printed matter for sale or distribution	PUBLISH
popularization.n.02	the act of making something attractive to the general public	PUBLISH
republication.n.02	the act of publishing again	PUBLISH
fight.n.05	a boxing or wrestling match	FIGHT
dogfight.n.03	an aerial engagement between fighter planes	FIGHT
duel.n.01	a prearranged fight with deadly weapons by two people (accompanied by seconds) in order to settle a quarrel over a point of honor	FIGHT
fencing.n.03	the art or sport of fighting with swords (especially the use of foils or epees or sabres to score points under a set of rules)	FIGHT
fistfight.n.01	a fight with bare fists	FIGHT
prizefight.n.01	a boxing match between professional boxers for a cash prize	FIGHT
match.n.02	a formal contest in which two or more persons or teams compete	FACE_CHALLENGE
scramble.n.01	an unceremonious and disorganized struggle	FIGHT
hassle.n.02	disorderly fighting	FIGHT
shadowboxing.n.01	sparring with an imaginary opponent (for exercise or training)	FIGHT
brush.n.06	a minor short-term fight	FIGHT
spar.n.03	making the motions of attack and defense with the fists and arms; a part of training for a boxer	FIGHT
dressing.n.07	the act of applying a bandage	PUT_APPLY_PLACE_PAVE
cut-in.n.02	(film) a still picture that is introduced and that interrupts the action of a film	PUT_APPLY_PLACE_PAVE
plonk.n.02	the noise of something dropping (as into liquid)	PUT_APPLY_PLACE_PAVE
transplant.n.02	an operation moving an organ from one organism (the donor) to another (the recipient)	PUT_APPLY_PLACE_PAVE
set.n.07	the act of putting something in position	PUT_APPLY_PLACE_PAVE
lubrication.n.02	an application of a lubricant to something	PUT_APPLY_PLACE_PAVE
mining.n.02	laying explosive mines in concealed places to destroy enemy personnel and equipment	PUT_APPLY_PLACE_PAVE
paving.n.03	the act of applying paving materials to an area	PUT_APPLY_PLACE_PAVE
position.n.06	a job in an organization	ASSIGN-smt-to-smn
repositioning.n.01	the act of placing in a new position	PUT_APPLY_PLACE_PAVE
reshipment.n.01	the act of shipping again (especially by transferring to another ship)	PUT_APPLY_PLACE_PAVE
slating.n.03	the act of laying slates for a roof	PUT_APPLY_PLACE_PAVE
roofing.n.02	the craft of a roofer	MOUNT_ASSEMBLE_PRODUCE
tessellation.n.02	the act of adorning with mosaic	PUT_APPLY_PLACE_PAVE
tinning.n.01	the application of a thin layer of soft solder to the ends of wires before soldering them	PUT_APPLY_PLACE_PAVE
placation.n.01	the act of placating and overcoming distrust and animosity	MAKE-RELAX
fraternization.n.01	associating with others in a brotherly or friendly way; especially with an enemy	BEFRIEND
consolidation.n.02	the act of combining into an integral whole	COMBINE_MIX_UNITE
relation.n.06	(usually plural) mutual dealings or connections among persons or groups	CORRELATE
dealings.n.01	social or verbal interchange (usually followed by `with')	MANAGE
sounding.n.02	the act of measuring depth of water (usually with a sounding line)	MEASURE_EVALUATE
bathymetry.n.01	measuring the depths of the oceans	MEASURE_EVALUATE
scalage.n.02	the act of scaling in weight or quantity or dimension	MEASURE_EVALUATE
scaling.n.02	act of measuring or arranging or adjusting according to a scale	MEASURE_EVALUATE
titration.n.01	a measured amount of a solution of unknown concentration is added to a known volume of a second solution until the reaction between them is just complete; the concentration of the unknown solution (the titer) can then be calculated	MEASURE_EVALUATE
addition.n.02	the act of adding one thing to another	ADD
summation.n.04	the arithmetic operation of summing; calculating the sum of two or more numbers	ADD
supplementation.n.02	the act of supplementing	ADD
leverage.n.03	investing with borrowed money as a way to amplify potential gains (at the risk of greater losses)	ADD
investing.n.01	the act of investing; laying out money or capital in an enterprise with the expectation of profit	LEND
encounter.n.03	a casual meeting with a person or thing	MEET
congregation.n.03	the act of congregating	MEET
meet.n.01	a meeting at which a number of athletic contests are held	MEET
rendezvous.n.01	a meeting planned at a certain time and place	MEET
mime.n.02	a performance using gestures and body movements without words	SIGN
dilution.n.02	weakening (reducing the concentration) by the addition of water or a thinner	WEAKEN
weakening.n.02	the act of reducing the strength of something	WEAKEN
corruption.n.05	destroying someone's (or some group's) honesty or loyalty; undermining moral integrity	DEBASE_ADULTERATE
demoralization.n.01	destroying the moral basis for a doctrine or policy	DEBASE_ADULTERATE
profanation.n.02	degradation of something worthy of respect; cheapening	DEBASE_ADULTERATE
spoliation.n.01	(law) the intentional destruction of a document or an alteration of it that destroys its value as evidence	DEBASE_ADULTERATE
impairment.n.04	damage that results in a reduction of strength or quality	DEBASE_ADULTERATE
spoil.n.02	the act of spoiling something by causing damage to it	DEBASE_ADULTERATE
injury.n.04	an act that causes someone or something to receive physical damage	HURT_HARM_ACHE
devaluation.n.01	an official lowering of a nation's currency; a decrease in the value of a country's currency relative to that of foreign countries	DEBASE_ADULTERATE
devaluation.n.02	the reduction of something's value or worth	DEBASE_ADULTERATE
discount.n.01	the act of reducing the selling price of merchandise	DEBASE_ADULTERATE
disqualification.n.02	the act of preventing someone from participating by finding them unqualified	DEBASE_ADULTERATE
write-off.n.02	the act of cancelling from an account a bad debt or a worthless asset	CANCEL_ELIMINATE
marginalization.n.01	the social process of becoming or being made marginal (especially as a group within the larger society)	DEBASE_ADULTERATE
recusation.n.01	(law) the disqualification of a judge or jury by reason of prejudice or conflict of interest; a judge can be recused by objections of either party or judges can disqualify themselves	DEBASE_ADULTERATE
vulgarization.n.01	the act of rendering something coarse and unrefined	DEBASE_ADULTERATE
call-out.n.01	a challenge to a fight or duel	FACE_CHALLENGE
challenge.n.03	questioning a statement and demanding an explanation	FACE_CHALLENGE
confrontation.n.01	a bold challenge	FACE_CHALLENGE
confrontation.n.05	a focussed comparison; bringing together for a careful comparison	FACE_CHALLENGE
defiance.n.02	a hostile challenge	FACE_CHALLENGE
emulation.n.03	effort to equal or surpass another	SIMULATE
imitation.n.03	copying (or trying to copy) the actions of someone else	SIMULATE
heckling.n.01	shouting to interrupt a speech with which you disagree	FACE_CHALLENGE
playoff.n.01	any final competition to determine a championship	FACE_CHALLENGE
replay.n.01	something (especially a game) that is played again	PLAY_SPORT/GAME
tournament.n.01	a sporting competition in which contestants play a series of games to decide the winner	FACE_CHALLENGE
census.n.01	a periodic count of the population	COUNT
countdown.n.01	counting backward from an arbitrary number to indicate the time remaining before some event (such as launching a space vehicle)	COUNT
miscount.n.01	an inaccurate count	COUNT
recount.n.01	an additional (usually a second) count; especially of the votes in a close election	COUNT
alphabetization.n.01	the act of putting in alphabetical order	SORT_CLASSIFY_ARRANGE
categorization.n.03	the act of distributing things into classes or categories of the same type	SORT_CLASSIFY_ARRANGE
juxtaposition.n.01	the act of positioning close together (or side by side)	BORDER
relegation.n.02	the act of assigning (someone or something) to a particular class or category	SORT_CLASSIFY_ARRANGE
codification.n.01	the act of codifying; arranging in a systematic order	SORT_CLASSIFY_ARRANGE
collation.n.02	assembling in proper numerical or logical sequence	SORT_CLASSIFY_ARRANGE
dichotomization.n.01	the act of dividing into two sharply different categories	SORT_CLASSIFY_ARRANGE
recoding.n.01	converting from one code to another	SORT_CLASSIFY_ARRANGE
redistribution.n.01	distributing again	SORT_CLASSIFY_ARRANGE
serialization.n.01	publication in serial form	SORT_CLASSIFY_ARRANGE
tabulation.n.02	the act of putting into tabular form	SORT_CLASSIFY_ARRANGE
realization.n.06	something that is made real or concrete	CREATE_MATERIALIZE
aquatint.n.02	a method of etching that imitates the broad washes of a water color	CREATE_MATERIALIZE
engraving.n.03	making engraved or etched plates and printing designs from them	CAVE_CARVE
molding.n.01	the act of creating something by casting it in a mold	CREATE_MATERIALIZE
neologism.n.02	the act of inventing a word or phrase	CREATE_MATERIALIZE
invention.n.03	the act of inventing	CREATE_MATERIALIZE
mintage.n.03	act or process of minting coins	CREATE_MATERIALIZE
compilation.n.02	the act of compiling (as into a single book or file or list)	AMASS
devisal.n.01	the act of devising something	CREATE_MATERIALIZE
design.n.01	the act of working out the form of something (as by making a sketch or outline or plan)	CREATE_MATERIALIZE
planning.n.02	the act or process of drawing up plans or layouts for some project or enterprise	CREATE_MATERIALIZE
drafting.n.01	writing a first version to be filled out and polished later	CREATE_MATERIALIZE
fold.n.07	the act of folding	CREATE_MATERIALIZE
run-through.n.01	an uninterrupted rehearsal	CREATE_MATERIALIZE
orchestration.n.02	the act of arranging a piece of music for an orchestra and assigning parts to the different musical instruments	CREATE_MATERIALIZE
lexicalization.n.01	the process of making a word to express a concept	CREATE_MATERIALIZE
metrification.n.01	writing a metrical composition (or the metrical structure of a composition)	CREATE_MATERIALIZE
malformation.n.02	something abnormal or anomalous	CREATE_MATERIALIZE
versification.n.03	the art or practice of writing verse	CREATE_MATERIALIZE
programming.n.02	creating a sequence of instructions to enable the computer to do something	CREATE_MATERIALIZE
sculpture.n.02	creating figures or designs in three dimensions	CAVE_CARVE
sloganeering.n.01	persuasion by means of empty slogans	CREATE_MATERIALIZE
care.n.05	attention and management implying responsibility for safety	WORK
conducting.n.01	the way of administering a business	MANAGE
deal.n.07	the type of treatment received (especially as the result of an agreement)	MANAGE
corner.n.07	a temporary monopoly on a kind of commercial trade	MANAGE
housework.n.01	the work of cleaning and running a house	MANAGE
juggle.n.01	the act of rearranging things to give a misleading impression	MANAGE
mismanagement.n.01	management that is careless or inefficient	MANAGE
misconduct.n.01	bad or dishonest management by persons supposed to act on another's behalf	MANAGE
operation.n.02	a business especially one run on a large scale	MANAGE
running.n.04	the act of administering or being in charge of something	MANAGE
president_of_the_united_states.n.02	the office of the United States head of state	MANAGE
prorogation.n.01	discontinuation of the meeting (of a legislative body) without dissolving it	DELAY
procrastination.n.01	the act of procrastinating; putting off or delaying or defering an action to a later time	DELAY
reprieve.n.04	the act of reprieving; postponing or remitting punishment	DELAY
deceleration.n.01	a decrease in rate of change	SLOW-DOWN
advection.n.01	(meteorology) the horizontal transfer of heat or other atmospheric properties	DIRECT_AIM_MANEUVER
aim.n.03	the action of directing something at an object	DIRECT_AIM_MANEUVER
bank.n.10	a flight maneuver; aircraft tips laterally about its longitudinal axis (especially in turning)	DIRECT_AIM_MANEUVER
steering.n.03	the act of steering a ship	DIRECT_AIM_MANEUVER
cover.n.07	fire that makes it difficult for the enemy to fire on your own individuals or formations	DIRECT_AIM_MANEUVER
hand.n.14	physical assistance	DIRECT_AIM_MANEUVER
maneuver.n.01	a military training exercise	DIRECT_AIM_MANEUVER
sublimation.n.02	(psychology) modifying the natural expression of an impulse or instinct (especially a sexual one) to one that is socially acceptable	DIRECT_AIM_MANEUVER
replication.n.07	the repetition of an experiment in order to test the validity of its conclusion	REPEAT
echo.n.03	a reply that repeats what has just been said	REPEAT
reduplication.n.04	the act of repeating over and again (or an instance thereof)	REPEAT
iteration.n.01	(computer science) a single execution of a set of instructions that are to be repeated	REPEAT
iteration.n.02	(computer science) executing the same set of instructions a given number of times or until a specified result is obtained	REPEAT
iteration.n.03	doing or saying again; a repeated performance	REPEAT
palingenesis.n.01	emergence during embryonic development of various characters or structures that appeared during the evolutionary history of the strain or species	REPEAT
wedding.n.01	the social event at which the ceremony of marriage is performed	EMCEE
officiation.n.02	the performance of a religious or ceremonial or public duty	WORK
function.n.03	the actions and activities assigned to or required or expected of a person or group	WORK
office.n.06	a religious rite or service prescribed by ecclesiastical authorities	WORK
drag.n.06	the act of dragging (pulling with force)	PULL
draft.n.11	the act of moving a load by drawing or pulling	PULL
retraction.n.02	the act of pulling or holding or drawing a part back	PULL
pluck.n.02	the act of pulling and releasing a taut cord	PULL
tow.n.01	the act of hauling something (as a vehicle) by means of a hitch or rope	PULL
dash.n.02	a quick run	RUN
shimmer.n.01	a weak and tremulous light	LIGHT_SHINE
rack.n.07	a rapid gait of a horse in which each foot strikes the ground separately	RUN
scamper.n.01	rushing about hastily in an undignified way	RUN
conglomeration.n.03	an occurrence combining miscellaneous things into a (more or less) rounded mass	AMASS
agglutination.n.01	a clumping of bacteria or red cells when held together by antibodies (agglutinins)	AMASS
combination.n.06	the act of arranging elements into specified groups without regard to order	COMBINE_MIX_UNITE
centralization.n.02	gathering to a center	AMASS
centralization.n.01	the act of consolidating power under a central control	AMASS
curdling.n.01	the process of forming semisolid lumps in a liquid	CHANGE-APPEARANCE/STATE
hemagglutination.n.01	agglutination of red blood cells	AMASS
thickening.n.03	the act of thickening	CHANGE-APPEARANCE/STATE
blink.n.01	a reflex that closes and opens the eyes rapidly	FACIAL-EXPRESSION
glare.n.02	an angry stare	SEE
palpebration.n.01	repeated blinking or winking (especially if uncontrolled and persistent)	FACIAL-EXPRESSION
squint.n.02	the act of squinting; looking with the eyes partly closed	FACIAL-EXPRESSION
vengeance.n.01	the act of taking revenge (harming someone in retaliation for something harmful that they have done) especially in the next life; --Romans 12:19; --James Garfield	PUNISH
adornment.n.02	the action of decorating yourself with something colorful and interesting	EMBELLISH
ornamentation.n.03	the act of adding extraneous decorations to something	EMBELLISH
beautification.n.01	the act of making something more beautiful	EMBELLISH
embellishment.n.01	elaboration of an interpretation by the use of decorative (sometimes fictitious) detail	EMBELLISH
complication.n.01	the act or process of complicating	EMBELLISH
primping.n.01	careful or finicky grooming	EMBELLISH
dressing.n.06	the activity of getting dressed; putting on clothes	DRESS_WEAR
endearment.n.01	the act of showing affection	EMBELLISH
face_lift.n.01	plastic surgery to remove wrinkles and other signs of aging from your face; an incision is made near the hair line and skin is pulled back and excess tissue is excised	EMBELLISH
filing.n.03	the act of using a file (as in shaping or smoothing an object)	EMBELLISH
formation.n.02	the act of fabricating something in a particular shape	MOUNT_ASSEMBLE_PRODUCE
fabrication.n.03	the act of making something (a product) from raw materials	MOUNT_ASSEMBLE_PRODUCE
gentrification.n.01	the restoration of run-down urban areas by the middle class (resulting in the displacement of low-income residents)	EMBELLISH
glamorization.n.01	the act of glamorizing; making something or someone more beautiful (often in a superficial way)	EMBELLISH
landscaping.n.01	working as a landscape gardener	EMBELLISH
gardening.n.01	the cultivation of plants	WORK
manicure.n.01	professional care for the hands and fingernails	EMBELLISH
pargeting.n.03	ornamental plastering	EMBELLISH
pedicure.n.01	professional care for the feet and toenails	EMBELLISH
titivation.n.01	sprucing up; making decorative additions to	EMBELLISH
lodging.n.03	the act of lodging	STAY_DWELL
invite.n.01	a colloquial expression for invitation	HOST_MEAL_INVITE
reassurance.n.01	the act of reassuring; restoring someone's confidence	GUARANTEE_ENSURE_PROMISE
raffle.n.01	a lottery in which the prizes are goods rather than money	OFFER
mingling.n.01	the action of people mingling and coming into contact	PARTICIPATE
sit-in.n.01	a form of civil disobedience in which demonstrators occupy seats and refuse to move	PARTICIPATE
